{
  "$schema": "./schemas/tokens.schema.json",
  "$comment": "デザイントークンの正本（DR-0005 / DR-0007 / DR-0008）。semantic 層のみのフラット構成で、primitive 層は持たない。ここを直せば design/theme.css の --dh-* が変わる。theme.css は生成物なので直接編集しない。$measured だけは generate-theme.mjs が書き戻す実測値で、人は編集しない。",
  "color": {
    "$comment": "白い紙面と黒い文字。強調は赤紫の一色だけ（DR-0007）。アクセントはパープル寄り（DR-0008）。値は oklch で書き、sRGB 色域に収まる範囲だけを使う。色域を外れるとブラウザ側のクリップで実測と描画がずれる。",
    "background": "oklch(1 0 0)",
    "surface": "oklch(0.97 0 0)",
    "text": "oklch(0.21 0 0)",
    "textMuted": "oklch(0.52 0 0)",
    "border": "oklch(0.62 0 0)",
    "accent": "oklch(0.47 0.22 305)",
    "accentSoft": "oklch(0.95 0.025 305)",
    "danger": "oklch(0.53 0.2 27)",
    "warning": "oklch(0.52 0.1 70)",
    "success": "oklch(0.52 0.13 150)"
  },
  "space": {
    "$comment": "4px 刻みの等比寄りスケール。レイアウトが使う余白はここからしか取らない（DR-0018 / no-raw-scale）。単位は px。",
    "2xs": 4,
    "xs": 8,
    "sm": 12,
    "md": 16,
    "lg": 24,
    "xl": 32,
    "2xl": 48,
    "3xl": 64,
    "4xl": 96
  },
  "type": {
    "$comment": "1280x720 のキャンバス上で読む前提の寸法。size は用途で名前を付ける。最小は caption で、min-font-size の下限そのものは design/rules.json を正本とする（DR-0012）。単位は px。",
    "family": {
      "sans": "system-ui, -apple-system, 'Segoe UI', 'Hiragino Sans', 'Noto Sans JP', sans-serif",
      "mono": "ui-monospace, SFMono-Regular, Menlo, Consolas, 'Noto Sans Mono', monospace"
    },
    "size": {
      "deckTitle": 64,
      "statement": 44,
      "slideTitle": 40,
      "bodyLarge": 28,
      "body": 24,
      "caption": 20
    },
    "lineHeight": {
      "tight": 1.2,
      "normal": 1.5
    },
    "weight": {
      "regular": 400,
      "bold": 700
    }
  },
  "radius": {
    "$comment": "角丸は控えめに。装飾で語らない（DR-0007）。単位は px。",
    "none": 0,
    "sm": 4,
    "md": 8
  },
  "shadow": {
    "$comment": "影は原則使わない。none を既定に置き、紙面から浮かせる必要がある一箇所だけ raised を使う（DR-0007）。",
    "none": "none",
    "raised": "0 1px 2px oklch(0 0 0 / 0.08)"
  },
  "canvas": {
    "$comment": "固定キャンバスの寸法（DR-0004）。src/runtime/canvas.ts の定数と一致していることを validate-design.mjs が検査する（DR-0021）。ずれると no-overflow の基準面が条件ごとに変わる。単位は px。",
    "width": 1280,
    "height": 720
  },
  "$measured": {
    "$comment": "generate-theme.mjs が実測して書き戻す。手で編集しない。pnpm theme:check が再計算と突き合わせ、ずれていれば落とす。contrast は WCAG 2.1 のコントラスト比（小数第2位で切り捨て）、hueDistance は oklch の色相角の差（度）。基準値そのものは design/rules.json を正本とする（DR-0008 / DR-0011）。",
    "contrast": {
      "background|surface": 1.09,
      "background|text": 17.75,
      "background|textMuted": 5.48,
      "background|border": 3.64,
      "background|accent": 7.72,
      "background|accentSoft": 1.16,
      "background|danger": 5.86,
      "background|warning": 5.65,
      "background|success": 5.17,
      "surface|text": 16.28,
      "surface|textMuted": 5.03,
      "surface|border": 3.33,
      "surface|accent": 7.08,
      "surface|accentSoft": 1.06,
      "surface|danger": 5.37,
      "surface|warning": 5.18,
      "surface|success": 4.74,
      "text|textMuted": 3.23,
      "text|border": 4.87,
      "text|accent": 2.29,
      "text|accentSoft": 15.27,
      "text|danger": 3.02,
      "text|warning": 3.14,
      "text|success": 3.42,
      "textMuted|border": 1.5,
      "textMuted|accent": 1.4,
      "textMuted|accentSoft": 4.72,
      "textMuted|danger": 1.06,
      "textMuted|warning": 1.02,
      "textMuted|success": 1.06,
      "border|accent": 2.12,
      "border|accentSoft": 3.13,
      "border|danger": 1.61,
      "border|warning": 1.55,
      "border|success": 1.42,
      "accent|accentSoft": 6.64,
      "accent|danger": 1.31,
      "accent|warning": 1.36,
      "accent|success": 1.49,
      "accentSoft|danger": 5.04,
      "accentSoft|warning": 4.86,
      "accentSoft|success": 4.45,
      "danger|warning": 1.03,
      "danger|success": 1.13,
      "warning|success": 1.09
    },
    "hueDistance": {
      "accent|accentSoft": 0,
      "accent|danger": 82,
      "accent|warning": 125,
      "accent|success": 155,
      "accentSoft|danger": 82,
      "accentSoft|warning": 125,
      "accentSoft|success": 155,
      "danger|warning": 43,
      "danger|success": 123,
      "warning|success": 80
    }
  }
}
